{
  "arm": "B",
  "asset_conflicts": 0,
  "attempt_id": "vs-p0b-next-b-attempt-1",
  "base_sha": "acffeb51f6ba6d16be6872413a0fa9010d2547a2",
  "campaign_id": "vector-siege-phase-0b-revision",
  "candidate_branch": "benchmark/vector-siege/vs-p0b-next-b-attempt-1",
  "candidate_report_path": "results/phase-0b-revision/candidate-reports/vs-p0b-next-b-attempt-1.json",
  "candidate_sha": "c170d148e9d1a95689b6e3bdeaf6725c60d1c505",
  "changed_files": [
    "index.html",
    "src/main.ts",
    "src/shared-simulation/README.md",
    "src/shared-simulation/index.ts",
    "src/shared-simulation/random.ts",
    "src/shared-simulation/simulation.ts",
    "src/shared-simulation/types.ts",
    "tests/e2e/stage1.spec.ts",
    "tests/unit/simulation.test.ts"
  ],
  "coordination_seconds": 86,
  "dependency_conflicts": 0,
  "duplicate_or_abandoned_work": 0,
  "evaluator_result_path": "results/phase-0b-revision/evaluations/vs-p0b-next-b-attempt-1.json",
  "failure_class": null,
  "failure_reason": null,
  "fanout_elected": true,
  "interface_conflicts": 0,
  "official_pilot_score_modified": false,
  "predicted_path_drift_count": 0,
  "produced_work": true,
  "provider_wait_seconds": 0,
  "quality_score": 100,
  "replacement_disposition": "not-eligible",
  "replacement_eligible": false,
  "rescue_events": 0,
  "run_id": "vs-p0b-next-b",
  "schema_version": "task-parallelism-phase-0b-revision-candidate-result.v1",
  "semantic_conflicts": 0,
  "skill_context_tokens": 0,
  "skill_loads": 10,
  "terminal_status": "completed",
  "tokens": {
    "cached_input": 14519808,
    "input": 14908719,
    "output": 45933
  },
  "wall_clock_comparable": true,
  "wall_clock_scope": "runner-integrated",
  "wall_clock_seconds": 1767,
  "worker_count": 3
}
